[
  {
    "id": "FILM",
    "season": 0,
    "number": 0,
    "title_en": "Fargo",
    "title_he": "פארגו",
    "air_date": "1996-03-08",
    "story_year": 1987,
    "director": "Joel Coen",
    "writers": [
      "Ethan Coen",
      "Joel Coen"
    ],
    "synopsis_en": "In 1987, car salesman Jerry Lundegaard hires Carl Showalter and Gaear Grimsrud to kidnap his wife Jean for a ransom from her father, Wade. Near Brainerd they kill a trooper and two witnesses. Pregnant chief Marge Gunderson takes the case. Wade brings the money himself. Carl shoots him and buries the cash by the road. Gaear kills Jean, then Carl, with an axe. Marge finds Gaear feeding the body into a woodchipper, shoots him in the leg, and arrests him. Troopers take Jerry outside Bismarck.",
    "synopsis_he": "ב-1987 סוחר המכוניות ג'רי לנדגארד ממיניאפוליס שוכר את קרל שאוולטר וגייר גרימסוד לחטוף את אשתו ג'ין, כדי לסחוט כופר מאביה וייד. ליד בריינרד השניים הורגים שוטר ושני עדים. מפקדת המשטרה מארג' גונדרסון, בהיריון, פותחת בחקירה. וייד מתעקש להביא את הכסף, וקרל יורה בו וטומן את רוב הסכום ליד הכביש. בבקתה גייר הורג את ג'ין ואחר כך את קרל בגרזן. מארג' מוצאת את גייר דוחף את הגופה למגרסת עצים, יורה לו ברגל ועוצרת אותו. שוטרים תופסים את ג'רי במוטל מחוץ לביסמרק.",
    "link_ids": []
  },
  {
    "id": "S1E01",
    "season": 1,
    "number": 1,
    "title_en": "The Crocodile's Dilemma",
    "title_he": "דילמת התנין",
    "air_date": "2014-04-15",
    "story_year": 2006,
    "director": "Adam Bernstein",
    "writers": [
      "Noah Hawley"
    ],
    "synopsis_en": "In January 2006, hitman Lorne Malvo hits a deer and wrecks outside Bemidji. A nearly naked man escapes his trunk into the snow and freezes in the woods. Insurance salesman Lester Nygaard breaks his nose in a run-in with Sam Hess, then meets Malvo at the hospital. Malvo kills Hess. At home, Lester beats his wife Pearl to death with a hammer. Chief Vern Thurman walks in, and Malvo shoots him. Lester stages a break-in. In Duluth, Gus Grimly stops Malvo for speeding and lets him go after a threat.",
    "synopsis_he": "בינואר 2006 לורן מאלוו מתנגש בצבי מחוץ לבמיג'י. גבר כמעט עירום בורח מתא המטען וקופא ביער. סוכן הביטוח לסטר נייגארד שובר את האף אחרי שסם הס משפיל אותו, ופוגש את מאלוו בבית החולים. מאלוו הורג את הס. בבית לסטר הורג את אשתו פרל במכת פטיש. המפקד ורן תורמן בא לחקור, מאלוו יורה בו ונעלם, ולסטר מביים פריצה. בדולות השוטר גאס גרימלי עוצר את מאלוו ומשחרר אותו אחרי איום.",
    "link_ids": []
  },
  {
    "id": "S1E02",
    "season": 1,
    "number": 2,
    "title_en": "The Rooster Prince",
    "title_he": "הנסיך התרנגול",
    "air_date": "2014-04-22",
    "story_year": 2006,
    "director": "Adam Bernstein",
    "writers": [
      "Noah Hawley"
    ],
    "synopsis_en": "Fargo hitmen Mr. Wrench and Mr. Numbers come to Bemidji to find who killed Sam Hess. They grab the wrong man and drown him in an ice-fishing hole. Bill Oswalt becomes chief and argues with Deputy Molly Solverson: he blames a drifter, while she ties Lester Nygaard to Hess, Pearl, and Chief Thurman. In Duluth, supermarket owner Stavros Milos hires Malvo to stop a blackmailer. Gus hears about the Bemidji murders and realizes the driver he released may be part of them.",
    "synopsis_he": "הרוצחים מר רנץ' ומר נמברס מגיעים מפארגו לבמיג'י לחפש את רוצח סם הס. הם חוטפים את האיש הלא נכון ומטביעים אותו בחור דיג בקרח. ביל אוסוולט מתמנה למפקד ומתעמת עם מולי סולוורסון: הוא מאשים נווד, והיא קושרת את לסטר נייגארד להס, לפרל ולתורמן. בדולות בעל הסופר סטברוס מילוס שוכר את מאלוו נגד סוחט. גאס שומע על הרציחות ומבין שהנהג ששחרר קשור אליהן.",
    "link_ids": []
  },
  {
    "id": "S1E03",
    "season": 1,
    "number": 3,
    "title_en": "A Muddy Road",
    "title_he": "דרך בוצית",
    "air_date": "2014-04-29",
    "story_year": 2006,
    "director": "Randall Einhorn",
    "writers": [
      "Noah Hawley"
    ],
    "synopsis_en": "Molly traces the frozen man to a St. Paul kidnapping over gambling debts. A camera shows part of the kidnapper's face. Wrench and Numbers see Lester with Hess's widow Gina, then corner him at the office until Molly arrives. Lester's reaction to Malvo's photo tells her he knows the man. Malvo finds blackmailer Don Chumph, takes the scheme, and preys on Stavros's faith: a dead dog, swapped pills, and blood from the shower. Gus confesses that he let Malvo drive off, then meets Molly in Bemidji.",
    "synopsis_he": "מולי מגלה שהאיש הקפוא נחטף מסנט פול בגלל חובות הימורים, ומצלמה תפסה חלק מפני החוטף. רנץ' ונמברס רואים את לסטר עם אלמנת הס, ג'ינה, ואז באים למשרד עד שמולי נכנסת. התגובה שלו לתמונה של מאלוו מסגירה שהוא מכיר אותו. מאלוו מאתר את הסוחט דון צ'אמפ, לוקח את הסחיטה, והופך את האמונה של סטברוס נגדו: כלב מת, כדורים מוחלפים ודם במקלחת. גאס מודה ששחרר את מאלוו ונוסע לבמיג'י לדבר עם מולי.",
    "link_ids": []
  },
  {
    "id": "S1E04",
    "season": 1,
    "number": 4,
    "title_en": "Eating the Blame",
    "title_he": "אכילת האשמה",
    "air_date": "2014-05-06",
    "story_year": 2006,
    "director": "Randall Einhorn",
    "writers": [
      "Noah Hawley"
    ],
    "synopsis_en": "In 1987, broke Stavros prays on a frozen road and finds a case of cash in the snow. In 2006, Malvo presses the fake plagues until Stavros fears God's punishment. Gus arrests Malvo near the house. Chief Oswalt, not Molly, comes to Duluth. Malvo's papers say he is a minister, so the police let him go. Wrench and Numbers kidnap Lester. He gets free, punches an officer, and lands in a cell for safety. The two hitmen then get themselves arrested and put in that same cell.",
    "synopsis_he": "ב-1987 סטברוס חסר הפרוטה מתפלל בכביש קפוא ומוצא מזוודת כסף בשלג. ב-2006 מאלוו ממשיך במכות המזויפות עד שסטברוס בטוח שאלוהים מעניש אותו. גאס עוצר את מאלוו ליד הבית. המפקד אוסוולט, לא מולי, מגיע לדולות. המסמכים של מאלוו מציגים אותו ככומר, והמשטרה משחררת אותו. רנץ' ונמברס חוטפים את לסטר. הוא בורח, מכה שוטר, ונכנס לתא בשביל ביטחון. השניים דואגים להיעצר ולהיכנס לאותו תא.",
    "link_ids": []
  },
  {
    "id": "S1E05",
    "season": 1,
    "number": 5,
    "title_en": "The Six Ungraspables",
    "title_he": "ששת הבלתי ניתנים לאחיזה",
    "air_date": "2014-05-13",
    "story_year": 2006,
    "director": "Colin Bucksey",
    "writers": [
      "Noah Hawley"
    ],
    "synopsis_en": "In jail, Lester gives Wrench and Numbers the name Lorne Malvo. They walk free. A shotgun pellet in Lester's hand has infected, so he goes to the hospital. Molly rides in the ambulance and questions him while he is hazy. She lays the links out for Chief Oswalt, who starts to see one case. Malvo locks Don Chumph in a pantry so the blackmail drop stays on track, then drives Stavros home. He notices Gus parked nearby, follows him, and threatens a neighbor who walks up to the car.",
    "synopsis_he": "בתא המעצר לסטר מוסר לרנץ' ולנמברס את השם לורן מאלוו. הם משתחררים. כדור ציד ביד של לסטר מזדהם, והוא נוסע לבית החולים. מולי נוסעת באמבולנס וחוקרת אותו כשהוא מעורפל. היא פורסת את הקשרים בפני המפקד אוסוולט, והוא מתחיל לראות תיק אחד. מאלוו נועל את דון צ'אמפ במזווה כדי שהסחיטה לא תיהרס, ומסיע את סטברוס הביתה. הוא מבחין בגאס חונה בקרבת מקום, עוקב אחריו, ומאיים על שכן שניגש אל המכונית.",
    "link_ids": []
  },
  {
    "id": "S1E06",
    "season": 1,
    "number": 6,
    "title_en": "Buridan's Ass",
    "title_he": "חמורו של בורידן",
    "air_date": "2014-05-20",
    "story_year": 2006,
    "director": "Colin Bucksey",
    "writers": [
      "Noah Hawley"
    ],
    "synopsis_en": "Malvo tapes Chumph to a bench with an empty gun, sprays the street, and leaves. Police raid the house and kill Chumph. In a blizzard, Wrench and Numbers ambush Malvo. He escapes, learns Fargo sent them, and kills Numbers. Gus shoots at a figure in the snow and hits Molly. Stavros buries the ransom where he once found cash. Fish rain down, his son's car crashes, and the boy dies. Lester hides the murder clues in Chazz's gun safe and sneaks back to his hospital bed.",
    "synopsis_he": "מאלוו קושר את צ'אמפ לספסל עם רובה ריק, יורה ברחוב ונמלט. השוטרים פורצים והורגים את צ'אמפ. בסופת שלג רנץ' ונמברס אורבים למאלוו. הוא בורח, שומע שפארגו שלחה אותם, והורג את נמברס. גאס יורה בדמות בשלג ופוגע במולי. סטברוס קובר את כופר הסחיטה במקום שבו מצא פעם כסף. דגים נופלים מהשמיים, המכונית של בנו מתהפכת, והילד מת. לסטר מחביא את ראיות הרצח בכספת הנשק של אחיו צ'אז וחוזר בחשאי למיטת בית החולים.",
    "link_ids": []
  },
  {
    "id": "S1E07",
    "season": 1,
    "number": 7,
    "title_en": "Who Shaves the Barber?",
    "title_he": "מי מגלח את הספר?",
    "air_date": "2014-05-27",
    "story_year": 2006,
    "director": "Scott Winant",
    "writers": [
      "Noah Hawley"
    ],
    "synopsis_en": "Molly lives, minus her spleen, and Gus is sick with guilt. A planted gun turns up at his nephew's school, then the rest of the evidence in Chazz's safe. Lester tells Chief Oswalt that Chazz killed Pearl and Thurman. Chazz is locked up and Lester walks free. Molly tells wounded Wrench that Numbers is dead. He says nothing. Malvo massacres the Fargo crew that sent the hitmen. Lester leads Gina Hess on about Sam's policy. Molly gets home and hears that the chief has cleared Lester.",
    "synopsis_he": "מולי שורדת בלי טחול, וגאס מלא אשמה. אקדח שלסטר הטמין מתגלה בבית הספר של האחיין, והמשטרה מוצאת את שאר הראיות בכספת של צ'אז. לסטר מספר לאוסוולט שצ'אז הרג את פרל ואת תורמן. צ'אז נכלא ולסטר יוצא חופשי. מולי אומרת לרנץ' הפצוע שנמברס מת, והוא שותק. מאלוו טובח בארגון מפארגו ששלח את השניים. לסטר מבטיח לג'ינה הס כסף על פוליסה שלא תשלם. מולי חוזרת הביתה ושומעת שהמפקד ניקה את לסטר.",
    "link_ids": []
  },
  {
    "id": "S1E08",
    "season": 1,
    "number": 8,
    "title_en": "The Heap",
    "title_he": "הערימה",
    "air_date": "2014-06-03",
    "story_year": 2006,
    "director": "Scott Winant",
    "writers": [
      "Noah Hawley"
    ],